id,data,cliente,assunto,descricao,prioridade,categoria_ia,prioridade_ia,impacto_ia,solucao_sugerida
1,2024-03-01,Empresa A,Erro de Login,"Utilizador não consegue aceder ao sistema, aparece mensagem de password incorreta mesmo após reset. ",Alta,SOFTWARE,ALTA,INDIVIDUAL,"Verificar status da conta do usuário no sistema de autenticação (ex: AD), realizar reset de senha manual e verificar logs do sistema para erros específicos."
2,2024-03-01,Empresa B,Lentidão na Base de Dados,O dashboard de vendas está a demorar mais de 30 segundos para carregar os relatórios mensais.,Media,SOFTWARE,ALTA,SETOR,"Analisar logs do banco de dados, otimizar consultas SQL do dashboard de vendas, verificar recursos do servidor de banco de dados (CPU, memória, I/O) e índices."
3,2024-03-02,Empresa C,Configuração de VPN,Solicitação de auxílio para configurar o novo perfil de VPN no Windows 11.,Baixa,REDES,BAIXA,INDIVIDUAL,Fornecer instruções detalhadas ou auxiliar o usuário na configuração do novo perfil de VPN no Windows 11.
4,2024-03-02,Empresa A,Impressora Offline,"A impressora do setor financeiro parou de responder na rede, mas o ping está normal.",Media,REDES,ALTA,SETOR,"Verificar configurações de rede da impressora, reiniciar o equipamento e o serviço de spooler de impressão no servidor (se houver). Testar impressão de página de teste."
5,2024-03-03,Empresa D,Pedido de Novo Acesso,Criar conta de utilizador para novo colaborador no módulo de RH.,Baixa,SOFTWARE,BAIXA,INDIVIDUAL,Criar conta de utilizador para o novo colaborador no módulo de RH.
6,2024-03-03,Empresa B,Ecrã Azul (BSOD),Portátil de um gestor apresenta ecrã azul intermitente ao iniciar o Outlook.,Critica,HARDWARE,ALTA,INDIVIDUAL,"Verificar logs de eventos para identificar a causa do BSOD, atualizar drivers (especialmente de vídeo e chipset), executar diagnóstico de hardware (memória/disco) e, se persistir, considerar reinstalação do sistema operacional ou substituição do equipamento."
